{
  "$schema": "http://json-schema.org/draft-07/schema#",
  "title": "birchtree configuration file",
  "description": "JSON config loaded by --config=PATH. Every key optional (absent = compiled default). Unknown keys rejected. CLI flags override file values. Units: sizes in bytes, worker_poll_interval_ms in milliseconds.",
  "type": "object",
  "additionalProperties": false,
  "properties": {
    "public_url": { "type": "string", "description": "Public base URL for actor/object URIs (http/https)." },
    "data_dir": { "type": "string", "description": "Directory holding birchtree.redb and media." },
    "listen": { "type": "string", "description": "Socket address, e.g. \"0.0.0.0:3000\"." },
    "trusted_proxies": { "type": "array", "items": { "type": "string" }, "description": "IPs trusted to set X-Forwarded-For." },
    "max_file_size": { "type": "integer", "minimum": 1, "description": "Max media upload, bytes. No CLI flag; file-only." },
    "max_body_size": { "type": "integer", "minimum": 1, "description": "Max HTTP body, bytes. Must be >= max_file_size." },
    "max_status_chars": { "type": "integer", "minimum": 1, "maximum": 3000, "description": "Max status length (URLs count 23). 500 = Mastodon parity." },
    "worker_poll_interval_ms": { "type": "integer", "minimum": 1, "description": "Worker poll interval, milliseconds. No CLI flag; file-only." },
    "registration_open": { "type": "boolean" },
    "registration_requires_approval": { "type": "boolean", "description": "Public registration queues accounts for approval." },
    "site_title": { "type": "string" },
    "site_description": { "type": "string" },
    "site_contact_email": { "type": "string" },
    "site_contact_username": { "type": ["string", "null"], "description": "Local contact handle, without @." },
    "streaming_api_base_url": { "type": ["string", "null"], "description": "Advertised streaming base (ws/wss/http/https). Null = serve from public host." },
    "federation_allow_http": { "type": "boolean", "description": "Allow http:// federation targets (lab only)." },
    "federation_allowlist": { "type": "array", "items": { "type": "string" }, "description": "Private CIDRs federation may reach, e.g. [\"10.0.0.0/8\"]." },
    "federation_extra_ca": { "type": ["string", "null"], "description": "PEM file of extra TLS trust roots (lab CA)." },
    "federation_authorized_fetch": { "type": "boolean" },
    "rate_limit_multiplier": { "type": "integer", "minimum": 1, "description": "1 = production limits." },
    "trends_enabled": { "type": "boolean", "description": "Serve approved trends. No CLI flag; file-only." },
    "peers_api_enabled": { "type": "boolean", "description": "Serve GET /api/v1/instance/peers. Default true. No CLI flag; file-only." },
    "activity_api_enabled": { "type": "boolean", "description": "Serve GET /api/v1/instance/activity. Default true. No CLI flag; file-only." },
    "domain_blocks_public": { "type": "boolean", "description": "Serve GET /api/v1/instance/domain_blocks. Default false (upstream default hidden). No CLI flag; file-only." },
    "local_live_feed_access": { "type": "string", "enum": ["public", "authenticated", "disabled"], "description": "Anonymous GET /api/v1/timelines/public (local). Default public. No CLI flag; file-only." },
    "remote_live_feed_access": { "type": "string", "enum": ["public", "authenticated", "disabled"], "description": "Anonymous public timeline (remote). Default public. No CLI flag; file-only." },
    "local_topic_feed_access": { "type": "string", "enum": ["public", "authenticated"], "description": "Anonymous tag/link timelines (local). Default public. No CLI flag; file-only." },
    "remote_topic_feed_access": { "type": "string", "enum": ["public", "authenticated", "disabled"], "description": "Anonymous tag/link timelines (remote). Default public. No CLI flag; file-only." },
    "search_mode": { "type": "string", "enum": ["embedded", "database", "off"] },
    "transcoding_enabled": { "type": "boolean" },
    "ffmpeg_path": { "type": "string" },
    "webp_quality": { "type": "integer", "minimum": 0, "maximum": 100 },
    "vp9_crf": { "type": "integer", "minimum": 0, "maximum": 63 },
    "vp9_cpu_used": { "type": "integer", "minimum": 0, "maximum": 5 },
    "opus_bitrate_kbps": { "type": "integer", "minimum": 1 },
    "transcode_wall_time_secs": { "type": "integer", "minimum": 1 },
    "transcode_max_output_bytes": { "type": "integer", "minimum": 1 },
    "transcode_max_memory_bytes": { "type": "integer", "minimum": 1 },
    "vapid_public_key": { "type": "string", "description": "Base64url VAPID public key for push." },
    "vapid_private_key": { "type": "string", "description": "Base64url VAPID private key. Accepts \"env:VAR\" indirection. Never logged." },
    "web_client_dir": { "type": ["string", "null"], "description": "Dir with keystodon's built bundle. Null = /app/* 404s." },
    "invites_enabled": { "type": "boolean", "description": "Honor invite tokens. No CLI flag; file-only." },
    "smtp_url": { "type": ["string", "null"], "description": "smtp:// or smtps:// provider URL. Null = mail explicitly disabled (503). Accepts \"env:VAR\" indirection. CLI: --smtp-url." },
    "mail_from": { "type": ["string", "null"], "description": "Envelope sender. Required when smtp_url is set. CLI: --mail-from." },
    "license_policy": { "type": "string", "enum": ["off", "unenforced", "enforced"], "description": "Core extension CORE-L: license policy. off = disabled (license params accepted-and-ignored). unenforced = enabled optional. enforced = enabled mandatory on top-level non-DM statuses with media. Default off." },
    "place_policy": { "type": "string", "enum": ["off", "unenforced", "enforced"], "description": "Core extension CORE-P: place policy. off = disabled (place_id accepted-and-ignored). unenforced = enabled optional. enforced = enabled mandatory on top-level non-DM statuses. Default off." },
    "alt_text_policy": { "type": "string", "enum": ["off", "nag", "block"], "description": "Core extension CORE-T: alt-text policy (local writes only). off = no change. nag = allow but return a documented nag signal. block = 422 when image/video lacks a description. Default off." }
  }
}
