{
  "public_url": "http://localhost:3000",
  "data_dir": "/data",
  "listen": "0.0.0.0:3000",
  "site_title": "Birchtree",
  "site_description": "A Mastodon-compatible server",
  "site_contact_email": "admin@localhost",
  "registration_open": false,
  "registration_requires_approval": false,
  "search_mode": "embedded",
  "transcoding_enabled": false
}
