{
  "public_url": "https://example.social",
  "data_dir": "./data",
  "listen": "0.0.0.0:3000",
  "site_title": "Example instance",
  "site_contact_email": "admin@example.social",
  "registration_open": true,
  "search_mode": "embedded",
  "smtp_url": "env:BIRCHTREE_SMTP_URL",
  "mail_from": "noreply@example.social"
}
